<?xml version="1.0"?>
<!--
/**
 * Copyright © Two.inc All rights reserved.
 * See COPYING.txt for license details.
 *
 * Schema for etc/brand.xml. One <brand> element per brand module
 * describes the brand-identity values (immutable at install time)
 * consumed by Two\Gateway\Model\Brand\Loader.
 */
-->
<xs:schema xmlns:xs="http://www.w3.org/2001/XMLSchema">
    <xs:element name="config">
        <xs:complexType>
            <xs:sequence>
                <xs:element name="brand" type="brandType" minOccurs="1" maxOccurs="unbounded"/>
            </xs:sequence>
        </xs:complexType>
        <xs:unique name="uniqueBrandCode">
            <xs:selector xpath="brand"/>
            <xs:field xpath="@code"/>
        </xs:unique>
    </xs:element>

    <xs:complexType name="brandType">
        <xs:all>
            <xs:element name="provider" type="xs:string"/>
            <xs:element name="provider_full_name" type="xs:string" minOccurs="0"/>
            <xs:element name="product_name" type="xs:string"/>
            <xs:element name="tab_label" type="xs:string"/>
            <xs:element name="tab_css_class" type="xs:string" minOccurs="0"/>
            <xs:element name="checkout_subtitle" type="xs:string" minOccurs="0"/>
            <xs:element name="checkout_url_template" type="xs:string"/>
            <xs:element name="brand_tag" type="xs:string" minOccurs="0"/>
            <xs:element name="sign_up_url" type="xs:string" minOccurs="0"/>
            <xs:element name="documentation_url" type="xs:string" minOccurs="0"/>
            <!-- Checkout "What is <product>?" link target; empty renders no link. -->
            <xs:element name="about_url" type="xs:string" minOccurs="0"/>
            <!-- Supplies the %1/%2 link args of <checkout_subtitle>; empty renders no tagline. -->
            <xs:element name="checkout_subtitle_faq_url" type="xs:string" minOccurs="0"/>
            <xs:element name="api_base_url" type="xs:string"/>
            <!--
                DEPRECATED, ignored by Loader: the offerable payment terms
                and the buyer-surcharge cap are now sourced per-merchant
                from GET /v1/merchant (available_terms / surcharge_limit),
                not from brand.xml. Kept optional in the schema so brand.xml
                files carrying the legacy elements still validate during the
                transition; remove once no brand.xml declares them.
            -->
            <xs:element name="available_payment_terms" type="paymentTermsType" minOccurs="0"/>
            <xs:element name="surcharge_fixed_max" type="surchargeFixedMaxType" minOccurs="0"/>
            <!--
                Buyer-surcharge rounding steps offered in the admin
                "Rounding step" dropdown (major currency units). Brand
                overlays narrow the parent default set (e.g. to 0.50 /
                1.00). Omit the element to inherit the parent default
                set; an empty element is treated as omitted.
            -->
            <xs:element name="surcharge_rounding_steps" type="surchargeRoundingStepsType" minOccurs="0"/>
            <!--
                On/off switch for the buyer-facing "order intent
                approved" reassurance notice rendered inline inside the
                checkout payment tile. Explicit boolean ONLY:

                  true    ⇒ notice ON
                  false   ⇒ notice suppressed entirely; no element is
                            emitted into the DOM, not an empty wrapper
                  absent  ⇒ documented explicit default `true`, which is
                            what keeps a third-party overlay that
                            declares nothing on ON
                  anything else ⇒ an error. The enumeration below fails
                            config validation in developer mode, and
                            Model\Brand\Loader additionally throws a
                            \DomainException, because nothing validates
                            brand.xsd in production mode.

                Base plugins declare it explicitly `true`; brand
                overlays that do not want the notice declare it
                explicitly `false`.
            -->
            <xs:element name="intent_approved_notice_enabled" type="explicitBooleanType" minOccurs="0"/>
            <!--
                COPY OVERRIDE ONLY — this element does NOT switch the
                notice off. That is <intent_approved_notice_enabled>
                above.

                  absent / visually blank
                          ⇒ INERT: platform default translated copy
                  non-blank
                          ⇒ used verbatim as the company-known copy
                            template (%1 = brand product name,
                            %2 = buyer company name,
                            %3 = buyer organisation number)

                An empty element used to mean "notice off" (TWO-25213).
                It no longer does — it is inert (TWO-25218), so an
                overlay carrying one resolves to notice ON. Suppression
                is <intent_approved_notice_enabled>false. Do not
                resurrect empty-means-off.
            -->
            <xs:element name="intent_approved_notice" type="xs:string" minOccurs="0"/>
            <!--
                On/off switch for the buyer-facing "order intent NOT
                approved" tile notice, the counterpart of
                <intent_approved_notice_enabled> above. Same
                explicit-boolean-only rule.

                This element is newer than the approved switch, so it
                carries an inheritance: declared here ⇒ that value;
                undeclared ⇒ ON when either <intent_declined_notice>
                is non-blank or <intent_approved_notice_enabled>
                resolved to true. Declare this element to decide the
                declined outcome independently of the approved one.
            -->
            <xs:element name="intent_declined_notice_enabled" type="explicitBooleanType" minOccurs="0"/>
            <!--
                COPY OVERRIDE ONLY for the "order intent NOT approved"
                notice — the counterpart of <intent_approved_notice>
                above, with the same absent/visually-blank ⇒ INERT
                rule and the same %1/%2/%3 template arguments.
                Suppression is <intent_declined_notice_enabled>false.
                Non-blank copy here also turns an undeclared declined
                switch ON.
            -->
            <xs:element name="intent_declined_notice" type="xs:string" minOccurs="0"/>
            <xs:element name="csp_origins" type="cspOriginsType" minOccurs="0"/>
            <xs:element name="admin_resource" type="xs:string"/>
            <xs:element name="module_label_chain" type="moduleLabelChainType" minOccurs="0"/>
            <xs:element name="extra_http_headers" type="extraHttpHeadersType" minOccurs="0"/>
            <xs:element name="allowed_fields" type="allowedFieldsType" minOccurs="0"/>
            <!--
                Show the per-term merchant fee inline beside each
                Payment Terms checkbox in admin (e.g. "30 days (1.50%
                + 0.50)"). Default true. Brand overlays set false to
                hide the inline fee preview (e.g. when their pricing
                contract makes the per-term cost noise rather than
                signal for the merchant).
            -->
            <xs:element name="inline_term_fees" type="xs:boolean" minOccurs="0"/>
        </xs:all>
        <xs:attribute name="code" type="brandCodeType" use="required"/>
        <xs:attribute name="tab_sort_order" type="xs:integer" use="required"/>
        <!--
            Short identifier used as the prefix for synthesised admin
            Configuration section IDs (e.g. `two` → `two_general`,
            `two_checkout_fields`, `two_search`, `two_payment`,
            `two_order_management`, `two_version` — TWO-25386's A-F
            regroup) and the synthesised admin tab id
            (`{prefix}_gateway`). Optional — when absent, derived by
            stripping a trailing `_payment` suffix from `code`.
        -->
        <xs:attribute name="section_prefix" type="brandCodeType" use="optional"/>
    </xs:complexType>

    <!--
        A boolean that must be spelled out. Deliberately NOT xs:boolean:
        xs:boolean also accepts `1` / `0`, and this switch is meant to
        read as a decision in the brand.xml, not as a flag. Lowercase
        `true` / `false` only.
    -->
    <xs:simpleType name="explicitBooleanType">
        <xs:restriction base="xs:string">
            <xs:enumeration value="true"/>
            <xs:enumeration value="false"/>
        </xs:restriction>
    </xs:simpleType>

    <xs:simpleType name="brandCodeType">
        <xs:restriction base="xs:string">
            <xs:pattern value="[a-z][a-z0-9_]*"/>
        </xs:restriction>
    </xs:simpleType>

    <xs:complexType name="paymentTermsType">
        <xs:sequence>
            <xs:element name="term" type="xs:positiveInteger" minOccurs="1" maxOccurs="unbounded"/>
        </xs:sequence>
    </xs:complexType>

    <xs:complexType name="surchargeFixedMaxType">
        <xs:attribute name="amount" type="xs:decimal" use="required"/>
        <xs:attribute name="currency" type="xs:string" use="required"/>
    </xs:complexType>

    <xs:complexType name="surchargeRoundingStepsType">
        <xs:sequence>
            <xs:element name="step" type="positiveDecimalType" minOccurs="1" maxOccurs="unbounded"/>
        </xs:sequence>
    </xs:complexType>

    <xs:simpleType name="positiveDecimalType">
        <xs:restriction base="xs:decimal">
            <xs:minExclusive value="0"/>
        </xs:restriction>
    </xs:simpleType>

    <xs:complexType name="cspOriginsType">
        <xs:sequence>
            <xs:element name="origin" type="xs:string" minOccurs="0" maxOccurs="unbounded"/>
        </xs:sequence>
    </xs:complexType>

    <xs:complexType name="moduleLabelChainType">
        <xs:sequence>
            <xs:element name="module" minOccurs="1" maxOccurs="unbounded">
                <xs:complexType>
                    <xs:simpleContent>
                        <xs:extension base="xs:string">
                            <xs:attribute name="label" type="xs:string" use="required"/>
                        </xs:extension>
                    </xs:simpleContent>
                </xs:complexType>
            </xs:element>
        </xs:sequence>
    </xs:complexType>

    <xs:complexType name="extraHttpHeadersType">
        <xs:sequence>
            <xs:element name="header" minOccurs="0" maxOccurs="unbounded">
                <xs:complexType>
                    <xs:simpleContent>
                        <xs:extension base="xs:string">
                            <xs:attribute name="name" type="xs:string" use="required"/>
                        </xs:extension>
                    </xs:simpleContent>
                </xs:complexType>
            </xs:element>
        </xs:sequence>
    </xs:complexType>

    <!--
        Fields to hide from the synthesised admin Configuration form
        for this brand. Each <field> has a `path` of the form
        `section_suffix/group/field`, e.g.
        `payment/payment_terms/payment_terms_duration_days`
        targets the field inside the synthesised
        `{section_prefix}_payment` → `payment_terms` group.

        SynthesiseBrandAdminForm sets
        showInDefault/Website/Store="0" on the matching field during
        section injection — the field stays declared in the canonical
        template but doesn't render. This is the preferred mechanism
        The fields an OVERLAY wants in its synthesised admin form,
        as `section_suffix/group/field` paths. An overlay is shown
        these and nothing else, so a field the base package adds
        later stays dormant on that brand until the brand names it.
        The base brand is not filtered.

        Replaces the earlier `suppressed_fields` denylist, which is
        no longer read: with an allowlist "not listed" already means
        hidden, and honouring both would leave two ways to say the
        same thing. An overlay still carrying the old element is not
        an error — nothing validates this schema at runtime — but it
        has no effect, and such a brand is shown nothing until it
        declares an allowlist.

        Avoids overlay modules needing a static `<section>` stub in
        their own system.xml (which would otherwise short-circuit the
        synthesised section ordering by inserting itself into the
        merged Structure first).
    -->
    <xs:complexType name="allowedFieldsType">
        <xs:sequence>
            <xs:element name="field" minOccurs="0" maxOccurs="unbounded">
                <xs:complexType>
                    <xs:attribute name="path" use="required">
                        <xs:simpleType>
                            <xs:restriction base="xs:string">
                                <xs:pattern value="[a-z][a-z0-9_]*/[a-z][a-z0-9_]*/[a-z][a-z0-9_]*"/>
                            </xs:restriction>
                        </xs:simpleType>
                    </xs:attribute>
                </xs:complexType>
            </xs:element>
        </xs:sequence>
    </xs:complexType>
</xs:schema>
