<?xml version="1.0"?>
<!--
/**
 * Copyright © Two.inc All rights reserved.
 * See COPYING.txt for license details.
 *
 * Default Two brand. Brand-overlay modules ship their own etc/brand.xml
 * to register additional brands. ActiveBrandResolver enforces the
 * single-overlay invariant; see Model/Brand/ActiveBrandResolver.php.
 */
-->
<config xmlns:xsi="http://www.w3.org/2001/XMLSchema-instance"
        xsi:noNamespaceSchemaLocation="urn:two-inc:magento2:Brand/etc/brand.xsd">
    <brand code="two_payment" section_prefix="two" tab_sort_order="500">
        <provider>Two</provider>
        <provider_full_name>Two</provider_full_name>
        <product_name>Two</product_name>
        <tab_label>Two</tab_label>
        <tab_css_class>two-extension two-extension--no-caption</tab_css_class>
        <checkout_url_template>https://%s.two.inc</checkout_url_template>
        <brand_tag></brand_tag>
        <sign_up_url>https://portal.two.inc/auth/merchant/signup</sign_up_url>
        <documentation_url>https://docs.two.inc/developer-portal/plugins/magento</documentation_url>
        <api_base_url>https://api.two.inc</api_base_url>
        <surcharge_rounding_steps>
            <step>0.10</step>
            <step>0.50</step>
            <step>1.00</step>
            <step>5.00</step>
            <step>10.00</step>
        </surcharge_rounding_steps>
        <!--
            Declared explicitly even though `true` is the documented
            default: the base plugin states its position rather than
            relying on the absence of a declaration.
        -->
        <intent_approved_notice_enabled>true</intent_approved_notice_enabled>
        <intent_declined_notice_enabled>true</intent_declined_notice_enabled>
        <admin_resource>Magento_Sales::config_sales</admin_resource>
        <module_label_chain>
            <module label="Payment Method">Two_Gateway</module>
            <module label="Hyva Extension">Two_GatewayHyva</module>
        </module_label_chain>
    </brand>
</config>
